inventory_id,standard,version,term_type,term_name,iri,prefix_local,parent,domain,range,cardinality,definition,definition_ko,concept_tag,equivalent_terms,notes,source_url
INV-2001,Croissant,1.0,Class,FileObject,http://mlcommons.org/croissant/FileObject,cr:FileObject,sc:CreativeWork,,,unspecified,FileObject is the Croissant class used to represent individual files that are part of a dataset.,데이터셋의 개별 파일을 나타내는 Croissant 클래스.,distribution.url,"schema:DataDownload, schema:MediaObject",Inherits from sc:CreativeWork; can represent DigitalDocument/MediaObject,https://docs.mlcommons.org/croissant/docs/croissant-spec.html#fileobject
INV-2002,Croissant,1.0,Class,FileSet,http://mlcommons.org/croissant/FileSet,cr:FileSet,sc:Intangible,,,unspecified,"In many datasets, data comes in the form of collections of homogeneous files, such as images, videos or text files, where each file needs to be treated as an individual item, e.g., as a training example. FileSet is a class that describes such collections of files.",동질적인 파일들의 모음(이미지·비디오·텍스트 등)을 표현하는 클래스.,distribution.url,,Extends sc:Intangible,https://docs.mlcommons.org/croissant/docs/croissant-spec.html#fileset
INV-2003,Croissant,1.0,Class,RecordSet,http://mlcommons.org/croissant/RecordSet,cr:RecordSet,sc:Intangible,,,unspecified,"A RecordSet describes a set of structured records obtained from one or more data sources (typically a file or set of files) and the structure of these records, expressed as a set of fields (e.g., the columns of a table). A RecordSet can represent flat or nested data.","하나 이상의 데이터 소스에서 얻은 구조화된 레코드 집합과 그 구조(필드 모음)를 기술. 평면·중첩 데이터 모두 표현 가능.",structure.recordset,,Subclass of sc:Intangible,https://docs.mlcommons.org/croissant/docs/croissant-spec.html#recordset
INV-2004,Croissant,1.0,Class,Field,http://mlcommons.org/croissant/Field,cr:Field,sc:Intangible,,,unspecified,"A Field is part of a RecordSet. It may represent a column of a table, or a nested data structure or even a nested RecordSet in the case of hierarchical data.",RecordSet의 일부. 테이블의 컬럼·중첩 구조·중첩 RecordSet을 표현 가능.,structure.field,,Subclass of sc:Intangible,https://docs.mlcommons.org/croissant/docs/croissant-spec.html#field
INV-2005,Croissant,1.0,Class,DataSource,http://mlcommons.org/croissant/DataSource,cr:DataSource,sc:Intangible,,,unspecified,DataSource is the class describing the data that can be extracted from files to populate a RecordSet.,RecordSet을 채우기 위해 파일에서 추출할 수 있는 데이터를 기술하는 클래스.,structure.field,,Subclass of sc:Intangible,https://docs.mlcommons.org/croissant/docs/croissant-spec.html#datasource
INV-2006,Croissant,1.0,Class,Extract,http://mlcommons.org/croissant/Extract,cr:Extract,,,,unspecified,"Sometimes, not all the data from the source is needed, but only a subset. The Extract class can be used to specify how to do that, depending on the type of the data.",소스에서 부분 데이터만 필요할 때 추출 방식을 지정하는 클래스.,uncategorized,,,https://docs.mlcommons.org/croissant/docs/croissant-spec.html#extract
INV-2007,Croissant,1.0,Class,Transform,http://mlcommons.org/croissant/Transform,cr:Transform,,,,unspecified,Croissant supports a few simple transformations that can be applied on the source data.,소스 데이터에 적용할 수 있는 단순 변환들의 클래스.,uncategorized,,,https://docs.mlcommons.org/croissant/docs/croissant-spec.html#transform
INV-2008,Croissant,1.0,Class,Format,http://mlcommons.org/croissant/Format,cr:Format,,,,unspecified,A format string used to parse the values coming from a DataSource.,DataSource에서 오는 값을 파싱하는 데 쓰이는 포맷 문자열.,distribution.media_type,,,https://docs.mlcommons.org/croissant/docs/croissant-spec.html#format
INV-2009,Croissant,1.0,Class,BoundingBox,http://mlcommons.org/croissant/BoundingBox,cr:BoundingBox,,,,unspecified,Croissant defines the type cr:BoundingBox that interprets any 4-float array as a bounding box.,4-float 배열을 경계 박스로 해석하는 Croissant 타입.,ml.bounding_box,,Used as semantic dataType,https://docs.mlcommons.org/croissant/docs/croissant-spec.html#boundingbox
INV-2010,Croissant,1.0,Class,SegmentationMask,http://mlcommons.org/croissant/SegmentationMask,cr:SegmentationMask,,,,unspecified,"Segmentation masks are common annotations in computer vision. They describe pixel-perfect zones that outline objects or groups of objects in images or videos. Croissant defines cr:SegmentationMask with two manners to describe them.",이미지·비디오에서 객체 영역을 픽셀 단위로 표시하는 분할 마스크 타입.,ml.bounding_box,,Used as semantic dataType; can be sc:GeoShape (polygon) or sc:ImageObject,https://docs.mlcommons.org/croissant/docs/croissant-spec.html#segmentationmask
INV-2011,Croissant,1.0,Class,Split,http://mlcommons.org/croissant/Split,cr:Split,,,,unspecified,"ML datasets may come in different data splits, intended to be used for different steps of a model building.",ML 데이터셋의 데이터 분할을 표현하는 시맨틱 dataType 클래스.,ml.split,,"[CHECK] Spec describes via section intro rather than formal class definition. Used as dataType marker on RecordSet",https://docs.mlcommons.org/croissant/docs/croissant-spec.html#splits
INV-2012,Croissant,1.0,Enumeration,TrainingSplit,http://mlcommons.org/croissant/TrainingSplit,cr:TrainingSplit,cr:Split,,,unspecified,Identifies the training subset of a dataset (the split used to train ML models).,데이터셋의 학습 분할 (모델 학습용).,ml.split,,"[CHECK] Spec only shows in example data; no standalone formal definition. Definition synthesized from context",https://docs.mlcommons.org/croissant/docs/croissant-spec.html#splits
INV-2013,Croissant,1.0,Enumeration,ValidationSplit,http://mlcommons.org/croissant/ValidationSplit,cr:ValidationSplit,cr:Split,,,unspecified,Identifies the validation subset of a dataset (the split used to tune model hyperparameters).,데이터셋의 검증 분할 (하이퍼파라미터 튜닝용).,ml.split,,"[CHECK] Spec only shows in example data; no standalone formal definition",https://docs.mlcommons.org/croissant/docs/croissant-spec.html#splits
INV-2014,Croissant,1.0,Enumeration,TestSplit,http://mlcommons.org/croissant/TestSplit,cr:TestSplit,cr:Split,,,unspecified,Identifies the test subset of a dataset (the split used to evaluate the final model).,데이터셋의 테스트 분할 (최종 모델 평가용).,ml.split,,"[CHECK] Spec only shows in example data; no standalone formal definition",https://docs.mlcommons.org/croissant/docs/croissant-spec.html#splits
INV-2015,Croissant,1.0,Class,Label,http://mlcommons.org/croissant/Label,cr:Label,,,,unspecified,"Most ML workflows use label data. In Croissant, we identify label data using the class cr:Label. Labels will typically appear as fields in a RecordSet. The default semantics is that labels apply to the record they are defined in.",ML 워크플로우의 레이블 데이터를 식별하는 클래스. RecordSet의 필드로 출현.,ml.label,,Used as dataType marker,https://docs.mlcommons.org/croissant/docs/croissant-spec.html#label-data
INV-2016,Croissant,1.0,Property,citeAs,http://mlcommons.org/croissant/citeAs,cr:citeAs,,sc:Dataset,sc:Text,0..1,"A citation to the dataset itself, or a citation for a publication that describes the dataset. Ideally, citations should be expressed using the bibtex format. Note that this is different from schema.org/citation, which is used to make a citation to another publication from this dataset.","데이터셋 자체 또는 데이터셋을 기술하는 출판물에 대한 인용. bibtex 형식 권장.",identification.identifier,"schema:citation",ONE cardinality per spec,https://docs.mlcommons.org/croissant/docs/croissant-spec.html#modified-and-added-properties
INV-2017,Croissant,1.0,Property,column,http://mlcommons.org/croissant/column,cr:column,,cr:Extract,sc:Text,0..1,A column name (used in Extract for CSV FileObject sources to extract values in the specified column).,추출할 CSV 컬럼 이름.,structure.field,,"Spec defines via Extract table; quoted text combined from column header 'A column name' + result description",https://docs.mlcommons.org/croissant/docs/croissant-spec.html#extract
INV-2018,Croissant,1.0,Property,containedIn,http://mlcommons.org/croissant/containedIn,cr:containedIn,,"cr:FileObject, cr:FileSet","cr:FileObject, cr:FileSet",0..*,"Another FileObject or FileSet that this one is contained in, e.g., in the case of a file extracted from an archive. When this property is present, the contentUrl is evaluated as a relative path within the container object.",이 파일이 포함된 다른 FileObject 또는 FileSet (예: 아카이브에서 추출된 파일).,structure.dataset,,"[CHECK] Not in JSON-LD context; defined in spec body only. MANY cardinality. FileSet definition extends: 'If multiple values are provided for containedIn, then the union of their contents is taken'",https://docs.mlcommons.org/croissant/docs/croissant-spec.html#fileobject
INV-2019,Croissant,1.0,Property,data,http://mlcommons.org/croissant/data,cr:data,,cr:RecordSet,JSON,0..*,One or more records that constitute the data of the RecordSet.,RecordSet의 데이터를 구성하는 레코드.,structure.recordset,,MANY cardinality; @json typed in JSON-LD context,https://docs.mlcommons.org/croissant/docs/croissant-spec.html#recordset
INV-2020,Croissant,1.0,Property,dataType,http://mlcommons.org/croissant/dataType,cr:dataType,,"cr:Field, cr:RecordSet",rdfs:Class,0..*,"The data type of the field, identified by the URI of the corresponding class. It could be either an atomic type (e.g, sc:Integer) or a semantic type (e.g., sc:GeoLocation).","필드의 데이터 타입. 대응 클래스의 URI로 식별. 원자 타입(sc:Integer) 또는 시맨틱 타입(sc:GeoLocation) 가능.",structure.field,,MANY cardinality; @vocab typed in JSON-LD context,https://docs.mlcommons.org/croissant/docs/croissant-spec.html#field
INV-2021,Croissant,1.0,Property,equivalentProperty,http://mlcommons.org/croissant/equivalentProperty,cr:equivalentProperty,,cr:Field,sc:URL,0..*,A property that is equivalent to this Field. Used in the case a dataType is specified on the RecordSet to map specific fields to specific properties associated with that dataType.,이 Field에 동등한 속성. RecordSet에 dataType이 지정된 경우 특정 필드를 해당 dataType과 연관된 속성에 매핑할 때 사용.,uncategorized,,"[CHECK] Not in JSON-LD context; defined in Field properties table. MANY cardinality",https://docs.mlcommons.org/croissant/docs/croissant-spec.html#field
INV-2022,Croissant,1.0,Property,examples,http://mlcommons.org/croissant/examples,cr:examples,,cr:RecordSet,"JSON, sc:URL",0..*,"One or more records provided as example content of the RecordSet, or a reference to data source that contains examples.","RecordSet의 예시 내용으로 제공되는 레코드 또는 예시를 담은 데이터 소스 참조.",structure.recordset,,MANY cardinality; @json typed in JSON-LD context,https://docs.mlcommons.org/croissant/docs/croissant-spec.html#recordset
INV-2023,Croissant,1.0,Property,excludes,http://mlcommons.org/croissant/excludes,cr:excludes,,cr:FileSet,sc:Text,0..*,A glob pattern that specifies the files to exclude.,제외할 파일을 지정하는 glob 패턴.,distribution.url,,"[CHECK] Not in JSON-LD context; defined in FileSet properties table. MANY cardinality",https://docs.mlcommons.org/croissant/docs/croissant-spec.html#fileset
INV-2024,Croissant,1.0,Property,extract,http://mlcommons.org/croissant/extract,cr:extract,,cr:DataSource,cr:Extract,0..1,The extraction method from the provided source.,제공된 소스로부터의 추출 방식.,structure.field,,ONE cardinality,https://docs.mlcommons.org/croissant/docs/croissant-spec.html#datasource
INV-2025,Croissant,1.0,Property,field,http://mlcommons.org/croissant/field,cr:field,,cr:RecordSet,cr:Field,0..*,"A data element that appears in the records of the RecordSet (e.g., one column of a table).","RecordSet의 레코드에 출현하는 데이터 요소 (예: 테이블의 한 컬럼).",structure.recordset,,MANY cardinality,https://docs.mlcommons.org/croissant/docs/croissant-spec.html#recordset
INV-2026,Croissant,1.0,Property,fileObject,http://mlcommons.org/croissant/fileObject,cr:fileObject,,cr:DataSource,cr:FileObject,0..1,The name of the referenced FileObject source of the data.,참조된 FileObject 데이터 소스의 이름.,distribution.url,,ONE cardinality; references via @id,https://docs.mlcommons.org/croissant/docs/croissant-spec.html#datasource
INV-2027,Croissant,1.0,Property,fileProperty,http://mlcommons.org/croissant/fileProperty,cr:fileProperty,,cr:Extract,sc:Text,0..1,"One of: fullpath, filename, content, lines, lineNumbers (used in Extract on FileObject/FileSet to select a file-level property).","파일 수준 속성 선택 (fullpath, filename, content, lines, lineNumbers 중 하나).",structure.field,,Spec lists 5 enum values in Extract table,https://docs.mlcommons.org/croissant/docs/croissant-spec.html#extract
INV-2028,Croissant,1.0,Property,fileSet,http://mlcommons.org/croissant/fileSet,cr:fileSet,,cr:DataSource,cr:FileSet,0..1,The name of the referenced FileSet source of the data.,참조된 FileSet 데이터 소스의 이름.,distribution.url,,ONE cardinality; references via @id,https://docs.mlcommons.org/croissant/docs/croissant-spec.html#datasource
INV-2029,Croissant,1.0,Property,format,http://mlcommons.org/croissant/format,cr:format,,cr:DataSource,cr:Format,0..1,"A format to parse the values of the data from text, e.g., a date format or number format.","텍스트에서 데이터 값을 파싱하는 포맷 (예: 날짜·숫자 포맷).",distribution.media_type,,ONE cardinality,https://docs.mlcommons.org/croissant/docs/croissant-spec.html#datasource
INV-2030,Croissant,1.0,Property,includes,http://mlcommons.org/croissant/includes,cr:includes,,cr:FileSet,sc:Text,0..*,A glob pattern that specifies the files to include.,포함할 파일을 지정하는 glob 패턴.,distribution.url,,MANY cardinality,https://docs.mlcommons.org/croissant/docs/croissant-spec.html#fileset
INV-2031,Croissant,1.0,Property,isLiveDataset,http://mlcommons.org/croissant/isLiveDataset,cr:isLiveDataset,,sc:Dataset,sc:Boolean,0..1,Whether the dataset is a live dataset.,데이터셋이 라이브 데이터셋인지 여부.,uncategorized,,"ONE cardinality. Live dataset = data evolves continuously (new snapshots released regularly)",https://docs.mlcommons.org/croissant/docs/croissant-spec.html#live-datasets
INV-2032,Croissant,1.0,Property,jsonPath,http://mlcommons.org/croissant/jsonPath,cr:jsonPath,,cr:Extract,sc:Text,0..1,A JSONPath expression (used in Extract on JSON sources to select values).,JSON 소스에서 값을 선택하는 JSONPath 표현식.,structure.field,,Defined in Extract table for JSON source,https://docs.mlcommons.org/croissant/docs/croissant-spec.html#extract
INV-2033,Croissant,1.0,Property,key,http://mlcommons.org/croissant/key,cr:key,,cr:RecordSet,cr:Field,0..*,One or more fields whose values uniquely identify each record in the RecordSet.,RecordSet의 각 레코드를 고유하게 식별하는 하나 이상의 필드.,identification.identifier,,MANY cardinality,https://docs.mlcommons.org/croissant/docs/croissant-spec.html#recordset
INV-2034,Croissant,1.0,Property,md5,http://mlcommons.org/croissant/md5,cr:md5,,cr:FileObject,sc:Text,0..1,The MD5 checksum of the file contents.,파일 내용의 MD5 체크섬.,uncategorized,"schema:sha256","[CHECK] Not formally defined as a standalone property in spec body; appears only in JSON-LD context. Definition synthesized from sc:sha256 analogy",https://docs.mlcommons.org/croissant/docs/croissant-spec.html#appendix-1-json-ld-context
INV-2035,Croissant,1.0,Property,parentField,http://mlcommons.org/croissant/parentField,cr:parentField,cr:subField,cr:Field,cr:Field,0..*,A special case of SubField that should be hidden because it references a Field that already appears in the RecordSet.,RecordSet에 이미 출현한 Field를 참조하므로 감춰야 하는 SubField의 특수 형태.,structure.field,,MANY cardinality,https://docs.mlcommons.org/croissant/docs/croissant-spec.html#field
INV-2036,Croissant,1.0,Property,path,http://mlcommons.org/croissant/path,cr:path,,,,unspecified,(No definition provided in specification body),(명세 본문에 정의 없음),uncategorized,,"[CHECK] Appears only in JSON-LD context (Appendix 1); no description in spec body. Possibly reserved/forward-looking",https://docs.mlcommons.org/croissant/docs/croissant-spec.html#appendix-1-json-ld-context
INV-2037,Croissant,1.0,Property,recordSet,http://mlcommons.org/croissant/recordSet,cr:recordSet,,cr:DataSource,cr:RecordSet,0..1,The name of the referenced RecordSet source.,참조된 RecordSet 소스의 이름.,structure.recordset,,"ONE cardinality per DataSource table. Same alias also used at sc:Dataset level to list RecordSets (MANY); spec doesn't formally define dual-domain usage. [CHECK]",https://docs.mlcommons.org/croissant/docs/croissant-spec.html#datasource
INV-2038,Croissant,1.0,Property,references,http://mlcommons.org/croissant/references,cr:references,,cr:Field,cr:Field,0..*,Another Field of another RecordSet that this field references. This is the equivalent of a foreign key reference in a relational database.,이 필드가 참조하는 다른 RecordSet의 다른 Field. 관계형 DB의 외래 키에 해당.,structure.field,,MANY cardinality,https://docs.mlcommons.org/croissant/docs/croissant-spec.html#field
INV-2039,Croissant,1.0,Property,regex,http://mlcommons.org/croissant/regex,cr:regex,,cr:Transform,sc:Text,0..1,A regular expression to parse the data.,데이터를 파싱하는 정규 표현식.,uncategorized,,One of the supported transformations,https://docs.mlcommons.org/croissant/docs/croissant-spec.html#transform
INV-2040,Croissant,1.0,Property,repeated,http://mlcommons.org/croissant/repeated,cr:repeated,,cr:Field,sc:Boolean,0..1,"If true, then the Field is a list of values of type dataType.","true이면 Field는 dataType 타입의 값 리스트가 됨.",structure.field,,ONE cardinality,https://docs.mlcommons.org/croissant/docs/croissant-spec.html#field
INV-2041,Croissant,1.0,Property,replace,http://mlcommons.org/croissant/replace,cr:replace,,cr:Transform,sc:Text,unspecified,A string replacement operation applied to source data values.,소스 데이터 값에 적용되는 문자열 치환 연산.,uncategorized,,"[CHECK] Not formally defined in spec body text; only appears in JSON-LD context. Definition synthesized from Transform context",https://docs.mlcommons.org/croissant/docs/croissant-spec.html#transform
INV-2042,Croissant,1.0,Property,separator,http://mlcommons.org/croissant/separator,cr:separator,,cr:Transform,sc:Text,unspecified,The character used to split a string into an array.,문자열을 배열로 분할하는 데 사용되는 문자.,uncategorized,,"[CHECK] Spec mentions 'delimiter' in Transform list but JSON-LD context uses 'separator' (cr:separator). Likely terminology mismatch in spec",https://docs.mlcommons.org/croissant/docs/croissant-spec.html#transform
INV-2043,Croissant,1.0,Property,source,http://mlcommons.org/croissant/source,cr:source,,cr:Field,"cr:DataSource, sc:URL",0..1,The data source of the field. This will generally reference a FileObject or FileSet's contents (e.g., a specific column of a table).,"필드의 데이터 소스. 일반적으로 FileObject·FileSet의 내용을 참조 (예: 테이블의 특정 컬럼).",structure.field,,ONE cardinality,https://docs.mlcommons.org/croissant/docs/croissant-spec.html#field
INV-2044,Croissant,1.0,Property,subField,http://mlcommons.org/croissant/subField,cr:subField,,cr:Field,cr:Field,0..*,Another Field that is nested inside this one.,이 Field 안에 중첩된 또 다른 Field.,structure.field,,MANY cardinality,https://docs.mlcommons.org/croissant/docs/croissant-spec.html#field
INV-2045,Croissant,1.0,Property,transform,http://mlcommons.org/croissant/transform,cr:transform,,cr:DataSource,cr:Transform,0..*,"A transformation to apply on source data on top of the extracted method as specified through extract, e.g., a regular expression or JSON query.","extract로 지정된 추출 방식 위에 소스 데이터에 적용할 변환 (예: 정규 표현식·JSON 쿼리).",uncategorized,,MANY cardinality,https://docs.mlcommons.org/croissant/docs/croissant-spec.html#datasource
